{
  "schema_version": "workflow-contributions/v1",
  "owner": {
    "id": "local.bob-code-consistency-review",
    "version": "0.1.0"
  },
  "registry_api": {
    "min": "provider-registry/v1",
    "max": "provider-registry/v1"
  },
  "action_providers": [
    {
      "id": "bobCodeConsistency.initializeWorkspace",
      "contract_version": "bobCodeConsistency.initializeWorkspace/v1"
    },
    {
      "id": "bobCodeConsistency.createReviewInput",
      "contract_version": "bobCodeConsistency.createReviewInput/v1"
    },
    {
      "id": "bobCodeConsistency.prepareAiReviewInputDraft",
      "contract_version": "bobCodeConsistency.prepareAiReviewInputDraft/v1"
    },
    {
      "id": "bobCodeConsistency.applyAiReviewInputDraft",
      "contract_version": "bobCodeConsistency.applyAiReviewInputDraft/v1"
    },
    {
      "id": "bobCodeConsistency.prepareAiTraceabilityDraft",
      "contract_version": "bobCodeConsistency.prepareAiTraceabilityDraft/v1"
    },
    {
      "id": "bobCodeConsistency.captureAiTraceabilityDraft",
      "contract_version": "bobCodeConsistency.captureAiTraceabilityDraft/v1"
    },
    {
      "id": "bobCodeConsistency.applyAiTraceabilityDraft",
      "contract_version": "bobCodeConsistency.applyAiTraceabilityDraft/v1"
    },
    {
      "id": "bobCodeConsistency.openTraceabilityPrep",
      "contract_version": "bobCodeConsistency.openTraceabilityPrep/v1"
    },
    {
      "id": "bobCodeConsistency.validateTraceabilityCatalog",
      "contract_version": "bobCodeConsistency.validateTraceabilityCatalog/v1"
    },
    {
      "id": "bobCodeConsistency.createReviewInputFromTraceability",
      "contract_version": "bobCodeConsistency.createReviewInputFromTraceability/v1"
    },
    {
      "id": "bobCodeConsistency.repairReviewInput",
      "contract_version": "bobCodeConsistency.repairReviewInput/v1"
    },
    {
      "id": "bobCodeConsistency.explainReviewInputDiagnostics",
      "contract_version": "bobCodeConsistency.explainReviewInputDiagnostics/v1"
    },
    {
      "id": "bobCodeConsistency.preprocess",
      "contract_version": "bobCodeConsistency.preprocess/v1"
    },
    {
      "id": "bobCodeConsistency.captureBobOutput",
      "contract_version": "bobCodeConsistency.captureBobOutput/v1"
    },
    {
      "id": "bobCodeConsistency.validateOutput",
      "contract_version": "bobCodeConsistency.validateOutput/v1"
    },
    {
      "id": "bobCodeConsistency.triage",
      "contract_version": "bobCodeConsistency.triage/v1"
    }
  ],
  "preflight_checks": [],
  "result_sinks": [],
  "workflow_templates": [],
  "schemas": []
}
